unique_identifier,title,document_type,published_on,document_url,source_specific_tags,top_topics,languages,document_theme,first_order_doi
10.1007/s40257-021-00607-6,"Recommendations for Vaccination in Children with Atopic Dermatitis Treated with Dupilumab: A Consensus Meeting, 2020",Clinical guidance,2021-06-02,https://www.ncbi.nlm.nih.gov/pmc/articles/PMC8169786/pdf,,"Vaccine, Cytotoxic T cell, MMR vaccine",eng,"health, health>diseases and conditions>communicable disease, science and technology, science and technology>biomedical science, science and technology>natural science, science and technology>natural science>biology, science and technology>biomedical science>pharmacology, health>diseases and conditions, health>diseases and conditions>communicable disease>virus disease, health>diseases and conditions>illness",10.1016/j.immuni.2006.02.006
10.1787/481685177056,Health Care Quality Indicators Project,Working paper,2006-03-09,https://dx.doi.org/10.1787/481685177056,,"Missing data, Mammography, Screening (medicine)",eng,"health>health treatment, health>diseases and conditions, health, science and technology, health>diseases and conditions>cancer, health>health treatment>medicine",10.1056/nejmra011223
10.2760/26856,Interferences between non-proliferation and science : ‘exporting’ dual-use know-how and technology in conformity with security imperatives.,Publication,2018-01-09,https://op.europa.eu/en/publication-detail/-/publication/7aa93b6b-f5bb-11e7-b8f5-01aa75ed71a1/language-en/format-PDF,,"Treaty on the Non-Proliferation of Nuclear Weapons, Nuclear proliferation, IAEA safeguards",eng,"economy, business and finance, health, science and technology, politics>international relations, politics, economy, business and finance>economy, science and technology>natural science, science and technology>social sciences",10.1007/s11948-007-9043-4
10.2777/17442,European textbook on ethics in research.,Publication,2011-01-04,https://op.europa.eu/en/publication-detail/-/publication/0f37f142-c333-40a8-90a7-bba25c314720/language-en/format-PDF,,"Consequentialism, Principlism, Ethics",eng,"science and technology>social sciences, society, society>values>ethics, society>values, science and technology>social sciences>philosophy, science and technology, health",10.1007/s11948-007-9043-4
10.2777/18849,Syllabus on ethics in research : addendum to the European textbook on ethics in research.,Publication,2011-01-04,https://op.europa.eu/en/publication-detail/-/publication/b38f1fd1-994d-45bb-b765-bf24391b549e/language-en/format-PDF,,"Informed consent, Principlism, Research",eng,"society, society>values>ethics, health>diseases and conditions, health>diseases and conditions>illness, health, society>values",10.1007/s11948-007-9043-4
10.2777/51536,European textbook on ethics in research.,Publication,2010-10-06,https://op.europa.eu/en/publication-detail/-/publication/12567a07-6beb-4998-95cd-8bca103fcf43/language-en/format-PDF,,"Consequentialism, Principlism, Ethics",eng,"science and technology>social sciences, society, society>values>ethics, society>values, science and technology>social sciences>philosophy, science and technology, health",10.1007/s11948-007-9043-4
10.2777/56382,Syllabus on ethics in research : addendum to the European textbook on ethics in research.,Publication,2010-09-08,https://op.europa.eu/en/publication-detail/-/publication/3b85d7d8-c113-44ad-97d1-408a01a9504f/language-en/format-PDF,,"Informed consent, Principlism, Research",eng,"society, society>values>ethics, health>diseases and conditions, health>diseases and conditions>illness, health, society>values",10.1007/s11948-007-9043-4
10.2777/7491,Ethics for researchers : facilitating research excellence in FP7.,Publication,2015-07-01,https://op.europa.eu/en/publication-detail/-/publication/68d86ebd-332f-46c0-8474-49fd93ba098f/language-en/format-PDF,,"Research, Animal testing, Convention for the Protection of Human Rights and Dignity of the Human Being with regard to the Application of Biology and Medicine",eng,"science and technology>natural science, society, society>values, science and technology>natural science>biology, science and technology>natural science>biology>genetics, science and technology, society>values>ethics",10.1007/978-1-4020-8312-9
10.25646/10113.13,Information on the treatment of monkeypox,Clinical guidance,2022-05-27,http://edoc.rki.de/176904/9881.13,"Amtliche Bekanntmachungen/Kommissionsveröffentlichungen, Article, Bekanntmachungen des Robert Koch-Instituts, DDC 610, Open Access Set, Primus Set, published version, textPublication","Post-exposure prophylaxis, Modified vaccinia Ankara, Vaccinia",ger,"health>diseases and conditions>illness, health>diseases and conditions, health",10.1128/aac.00762-07
10.2903/sp.efsa.2020.en-1934,Outcome of the public consultation on the draft Scientific Opinion on the evaluation of existing guidelines for their adequacy for the microbial characterisation and environmental risk assessment of micro‐organisms obtained through synthetic biology,Publication,2020-10-28,https://www.efsa.europa.eu/en/supporting/pub/en-1934,,"Synthetic biology, Bioinformatics, DNA sequencing",eng,"environment, health>diseases and conditions, health>diseases and conditions>communicable disease, science and technology>natural science>biology, science and technology>natural science, science and technology>natural science>biology>genetics, science and technology, health>diseases and conditions>communicable disease>virus disease, health, environment>nature",10.1016/j.febslet.2012.02.022
10.2875/590512,Final opinion on synthetic biology III : risks to the environment and biodiversity related to synthetic biology and research priorities in the field of synthetic biology.,Publication,2016-04-04,https://op.europa.eu/en/publication-detail/-/publication/9b231c71-faf1-11e5-b713-01aa75ed71a1/language-en/format-PDF,,"Convention on Biological Diversity, Biodiversity, Genetically modified organism",eng,"science and technology>natural science>biology, science and technology>natural science, science and technology>natural science>biology>genetics, environment, science and technology",10.1016/j.febslet.2012.02.022
10.2772/63529,Opinion on synthetic biology II : risk assessment methodologies and safety aspects.,Publication,2016-02-12,https://op.europa.eu/en/publication-detail/-/publication/bfd7d06c-d3ae-11e5-a4b5-01aa75ed71a1/language-en/format-PDF,,"Genetically modified organism, Synthetic biology, Xeno nucleic acid",eng,"economy, business and finance, economy, business and finance>economic sector, health, health>diseases and conditions, health>diseases and conditions>communicable disease, science and technology>natural science>biology, science and technology>natural science, science and technology>natural science>biology>genetics, science and technology, economy, business and finance>economic sector>chemicals, health>diseases and conditions>communicable disease>virus disease",10.1016/j.febslet.2012.02.022
10.1787/9789264213562-en,Biosafety and the Environmental Uses of Micro-Organisms,Publication,2015-01-22,https://dx.doi.org/10.1787/9789264213562-en,,"Mycorrhiza, Agrobacterium tumefaciens, Rhizobia",eng,"science and technology>natural science>biology>genetics, science and technology>natural science, science and technology>natural science>biology, economy, business and finance, economy, business and finance>economic sector, economy, business and finance>economic sector>chemicals, economy, business and finance>economic sector>agriculture, economy, business and finance>economic sector>chemicals>organic chemical, science and technology",10.1016/j.febslet.2012.02.022
10.2903/j.efsa.2017.4666,"EMA and EFSA Joint Scientific Opinion on measures to reduce the need to use antimicrobial agents in animal husbandry in the European Union, and the resulting impacts on food safety (RONAFA)",Scholarly article,2017-01-24,https://www.efsa.europa.eu/en/efsajournal/pub/4666,,"Medicine, One Health, Disease",eng,"science and technology, science and technology>natural science, health>diseases and conditions, health>diseases and conditions>illness, health, science and technology>natural science>biology",10.1162/isec.2010.34.4.96
10.4060/cb5798en,How to mainstream sustainability and circularity into the bioeconomy?,Publication,2021-01-01,https://openknowledge.fao.org/handle/20.500.14283/CB5798EN,"1 - Продукты знаний, Publicaciones, value chains","Agriculture, Biobased economy, Sustainable Development Goal 17",eng,"economy, business and finance, economy, business and finance>economic sector, lifestyle and leisure, lifestyle and leisure>lifestyle, science and technology>natural science>biology, science and technology>natural science, science and technology>natural science>biology>genetics, economy, business and finance>economic sector>agriculture, science and technology, lifestyle and leisure>lifestyle>food and drink, lifestyle and leisure>lifestyle>food and drink>organic food, environment",10.1080/10643389.2019.1579628
10.5281/zenodo.11629357,IPBES Invasive Alien Species Assessment: Full report,Publication,2024-02-23,https://zenodo.org/records/11629357,,"Forest, Littoral zone, Tundra",eng,"economy, business and finance, economy, business and finance>economic sector, environment>natural resources, science and technology>natural science, science and technology>natural science>biology, science and technology>natural science>biology>genetics, environment>natural resources>water, environment, science and technology, economy, business and finance>economic sector>agriculture",10.1016/j.jri.2006.04.006
10.5281/zenodo.11437851,"IPBES Invasive Alien Species Assessment: Chapter 5. Management; challenges, opportunities and lessons learned",Publication,2024-02-23,https://zenodo.org/records/11437851,,"Pest risk analysis, Honey bee, Environmental DNA",eng,"economy, business and finance, economy, business and finance>economic sector, environment, science and technology, science and technology>natural science, science and technology>natural science>biology, science and technology>natural science>biology>genetics, economy, business and finance>economic sector>agriculture, environment>nature",10.1016/j.jri.2006.04.006
10.2903/j.efsa.2020.6263,Evaluation of existing guidelines for their adequacy for the microbial characterisation and environmental risk assessment of microorganisms obtained through synthetic biology,Scholarly article,2020-10-28,https://www.efsa.europa.eu/en/efsajournal/pub/6263,,"Genetic code, Genetically modified organism, Whole genome sequencing",eng,"health>diseases and conditions, health>diseases and conditions>communicable disease, science and technology>natural science>biology, science and technology>natural science, science and technology>natural science>biology>genetics, science and technology, health>diseases and conditions>communicable disease>virus disease, health",10.1002/bies.201000099
10.2875/590512,Final opinion on synthetic biology III : risks to the environment and biodiversity related to synthetic biology and research priorities in the field of synthetic biology.,Publication,2016-04-04,https://op.europa.eu/en/publication-detail/-/publication/9b231c71-faf1-11e5-b713-01aa75ed71a1/language-en/format-PDF,,"Convention on Biological Diversity, Biodiversity, Genetically modified organism",eng,"science and technology>natural science>biology, science and technology>natural science, science and technology>natural science>biology>genetics, environment, science and technology",10.1002/bies.201000099
10.2772/76553,Opinion on synthetic biology I : definition.,Publication,2016-02-12,https://op.europa.eu/en/publication-detail/-/publication/4ee360d4-d3af-11e5-a4b5-01aa75ed71a1/language-en/format-PDF,,"Convention on Biological Diversity, Synthetic biology, Genetically modified organism",eng,"science and technology>natural science, science and technology>natural science>biology, science and technology>natural science>biology>genetics, science and technology",10.1002/bies.201000099
10.2861/31653,Making perfect life : European governance challenges in 21st century bio-engineering : final report.,Publication,2015-02-26,https://op.europa.eu/en/publication-detail/-/publication/1e592eb3-3a39-4d71-86c1-dbfcb286e721/language-en/format-PDF,,"Whole genome sequencing, Artificial intelligence, Synthetic biology",eng,"science and technology>natural science>biology, science and technology, health, science and technology>natural science>biology>genetics, science and technology>natural science, society",10.1002/bies.201000099
10.1787/9789264213562-en,Biosafety and the Environmental Uses of Micro-Organisms,Publication,2015-01-22,https://dx.doi.org/10.1787/9789264213562-en,,"Arbuscular mycorrhiza, Mycorrhiza, Rhizobia",eng,"science and technology>natural science>biology>genetics, science and technology>natural science, science and technology>natural science>biology, economy, business and finance, economy, business and finance>economic sector, economy, business and finance>economic sector>chemicals, economy, business and finance>economic sector>agriculture, economy, business and finance>economic sector>chemicals>organic chemical, science and technology",10.1002/bies.201000099
10.2796/28465,"The ethics of research security and of security research : proceedings of the fifth meeting of the European Commission International Dialogue on Bioethics, Brussels, Belgium, 17 September 2013.",Publication,2014-10-14,https://op.europa.eu/en/publication-detail/-/publication/afb7e4cc-68bb-4067-a436-cc288c5dadc5/language-en/format-PDF,,"DNA profiling, Synthetic biology, Dual-use technology",eng,"crime, law and justice, crime, law and justice>judiciary, science and technology>natural science, science and technology>natural science>biology, science and technology>natural science>biology>genetics, science and technology, crime, law and justice>judiciary>court, crime, law and justice>crime",10.1007/s11948-011-9298-7
10.1002/14651858.cd015769,Therapeutics for treating mpox in humans,Clinical guidance,2023-03-14,https://www.ncbi.nlm.nih.gov/pmc/articles/PMC10012405/pdf,,"Mpox, Systematic review, Randomized controlled trial",eng,"science and technology>biomedical science, health>diseases and conditions, health>diseases and conditions>illness, science and technology>biomedical science>pharmacology, health, science and technology",10.3390/v9110320
10.2796/28465,"The ethics of research security and of security research : proceedings of the fifth meeting of the European Commission International Dialogue on Bioethics, Brussels, Belgium, 17 September 2013.",Publication,2014-10-14,https://op.europa.eu/en/publication-detail/-/publication/afb7e4cc-68bb-4067-a436-cc288c5dadc5/language-en/format-PDF,,"DNA profiling, Synthetic biology, Dual-use technology",eng,"crime, law and justice, crime, law and justice>judiciary, science and technology>natural science, science and technology>natural science>biology, science and technology>natural science>biology>genetics, science and technology, crime, law and justice>judiciary>court, crime, law and justice>crime",10.1007/s11569-009-0074-y
10.1002/14651858.cd004913.pub2,Vaccines for preventing smallpox,Clinical guidance,2007-07-18,https://www.ncbi.nlm.nih.gov/pmc/articles/PMC6532594/pdf,,"Clinical trial, Smallpox vaccine, Vaccinia",eng,"health>health treatment, health>diseases and conditions>communicable disease, health>health treatment>preventative medicine, health>diseases and conditions>illness, health>diseases and conditions, health>diseases and conditions>communicable disease>virus disease, health, health>health treatment>preventative medicine>vaccines",10.1086/323808
10.2760/47988,JRC horizon scanning on dual-use civil and military research.,Publication,2020-10-13,https://op.europa.eu/en/publication-detail/-/publication/75e1f46a-12a8-11eb-9a54-01aa75ed71a1/language-en/format-PDF,,"Kilopower, SpaceX Starlink, Nootropic",eng,"economy, business and finance, economy, business and finance>economic sector, science and technology>natural science, science and technology>natural science>biology>genetics, science and technology>natural science>biology, science and technology, conflicts, war and peace, economy, business and finance>economic sector>computing and information technology",10.3389/fbioe.2018.00021
10.2760/78635,Investigating the capabilities and the competitiveness of the EU vis-aÌ-vis its main competitors in developing civilian technologies with critical spillovers into the defence.,Publication,2020-04-08,https://op.europa.eu/en/publication-detail/-/publication/a5a592cf-7a08-11ea-b75f-01aa75ed71a1/language-en/format-PDF,,"Unmanned aerial vehicle, Patent, Engineering",eng,"politics, politics>government, politics>government>defence>military equipment, science and technology, conflicts, war and peace, politics>government>defence>military equipment>military weaponry, politics>government>defence",10.1007/s11948-014-9535-y
10.5281/zenodo.11629357,IPBES Invasive Alien Species Assessment: Full report,Publication,2024-02-23,https://zenodo.org/records/11629357,,"Natural environment, Littoral zone, Tundra",eng,"economy, business and finance, economy, business and finance>economic sector, environment>natural resources, science and technology>natural science, science and technology>natural science>biology, science and technology>natural science>biology>genetics, environment>natural resources>water, environment, science and technology, economy, business and finance>economic sector>agriculture",10.1071/wr06167
10.5281/zenodo.11437851,"IPBES Invasive Alien Species Assessment: Chapter 5. Management; challenges, opportunities and lessons learned",Publication,2024-02-23,https://zenodo.org/records/11437851,,"European rabbit, Biology, African armyworm",eng,"economy, business and finance, economy, business and finance>economic sector, environment, science and technology, science and technology>natural science, science and technology>natural science>biology, science and technology>natural science>biology>genetics, economy, business and finance>economic sector>agriculture, environment>nature",10.1071/wr06167
10.5281/zenodo.3237373,The IPBES regional assessment report on biodiversity and ecosystem services for Asia and the Pacific,Publication,2018-03-24,https://zenodo.org/record/3237374,,"Biodiversity, Habitat destruction, Agriculture",eng,"economy, business and finance, economy, business and finance>economic sector, environment>natural resources, economy, business and finance>economic sector>agriculture, environment, environment>nature, environment>natural resources>water, environment>nature>ecosystem, environment>environmental pollution",10.1080/00450618.2014.882986
10.1787/9789264253018-en,"Safety Assessment of Transgenic Organisms in the Environment, Volume 5",Publication,2016-04-05,https://dx.doi.org/10.1787/9789264253018-en,,"Phagosome, Immune system, Bacterial adhesin",eng,"health, science and technology>natural science>biology, science and technology, science and technology>natural science, science and technology>natural science>biology>genetics, health>diseases and conditions>illness, science and technology>natural science>biology>physiology, health>diseases and conditions",10.1051/ebr:2008001
10.2760/47988,JRC horizon scanning on dual-use civil and military research.,Publication,2020-10-13,https://op.europa.eu/en/publication-detail/-/publication/75e1f46a-12a8-11eb-9a54-01aa75ed71a1/language-en/format-PDF,,"SpaceX Starlink, Nootropic, Artificial intelligence",eng,"economy, business and finance, economy, business and finance>economic sector, science and technology>natural science, science and technology>natural science>biology>genetics, science and technology>natural science>biology, science and technology, conflicts, war and peace, economy, business and finance>economic sector>computing and information technology",10.1007/s11948-016-9774-1
10.2777/7491,Ethics for researchers : facilitating research excellence in FP7.,Publication,2015-07-01,https://op.europa.eu/en/publication-detail/-/publication/68d86ebd-332f-46c0-8474-49fd93ba098f/language-en/format-PDF,,"Research, Animal testing, Convention for the Protection of Human Rights and Dignity of the Human Being with regard to the Application of Biology and Medicine",eng,"science and technology>natural science, society, society>values, science and technology>natural science>biology, science and technology>natural science>biology>genetics, science and technology, society>values>ethics",10.1007/s11948-008-9064-7
stateofnsw-64eaef4a3fc461bbbb54c70a875bba56,Mpox control guideline,Publication,2024-12-12,https://www.health.nsw.gov.au/Infectious/controlguideline/Documents/mpox-nsw-control-guideline.pdf,,"Mpox, Monkeypox virus, Infection",eng,"science and technology, science and technology>natural science, health>diseases and conditions, health>diseases and conditions>illness, health, science and technology>natural science>biology",10.1016/s1473-3099(03)00856-9
deptofhealthau-ddccff9ba43aa935bcc6acae9e9d4965,Mpox – CDNA National Guidelines for Public Health Units,Publication,2024-10-14,https://www.health.gov.au/resources/publications/mpox-cdna-national-guidelines-for-public-health-units?language=en,,"Mpox, Monkeypox virus, Infection",eng,"science and technology, science and technology>natural science, health>diseases and conditions, health>diseases and conditions>illness, health, science and technology>natural science>biology",10.1016/s1473-3099(03)00856-9
deptofhealthau-a8e84a587fa357b2c1324d4b0e830f12,Monkeypox virus infection – CDNA National Guidelines for Public Health Units,Publication,2022-12-22,https://www.health.gov.au/resources/publications/monkeypox-virus-infection-cdna-national-guidelines-for-public-health-units?language=en,,"Infection, Pathogen transmission, Infection prevention and control",eng,"science and technology>natural science, health>diseases and conditions, health>diseases and conditions>illness, health, science and technology, science and technology>natural science>biology",10.1016/s1473-3099(03)00856-9
deptofhealthau-b172c41caeb80fc8752d9896490da4f8,Monkeypox – Laboratory case definition,Publication,2022-10-05,https://www.health.gov.au/resources/publications/monkeypox-laboratory-case-definition?language=en,,"Monkeypox, Smallpox, Orthopoxvirus",eng,"health, health>diseases and conditions>communicable disease, science and technology, science and technology>natural science, health>diseases and conditions, health>diseases and conditions>communicable disease>virus disease, health>diseases and conditions>illness, science and technology>natural science>biology",10.1016/s1473-3099(03)00856-9
governmentofjamaica-4f139c1868dbf45100ec789f9bde0405,Monkeypox Epidemiological Surveillance Protocol,Publication,2022-07-06,https://www.moh.gov.jm/wp-content/uploads/2022/05/Monkeypox-Surveillance-Protocol-6-July-2022-V1.pdf,,"Monkeypox, Monkeypox virus, Orthopoxvirus",eng,"health>diseases and conditions>illness, health>diseases and conditions, health, health>diseases and conditions>communicable disease",10.1016/s1473-3099(03)00856-9
ecdc-5bc992b649bc634e1c64370e1d1b5a12,Risk assessment: Monkeypox multi-country outbreak,Publication,2022-05-23,https://www.ecdc.europa.eu/en/publications-data/risk-assessment-monkeypox-multi-country-outbreak,,"Public health, Monkeypox, Monkeypox virus",eng,"health>diseases and conditions>communicable disease, health>diseases and conditions, health>diseases and conditions>illness, health>diseases and conditions>communicable disease>virus disease, health",10.1016/s1473-3099(03)00856-9
ministrukabinets-c3c92115d77861a0e6911c3bb753496a,Monkeypox multi-country outbreak,Publication,2022-05-23,https://www.zva.gov.lv/sites/default/files/inline-files/Monkeypox-multi-country-outbreak.pdf,,"Mpox, Isolation (health care), Personal protective equipment",eng,"health>diseases and conditions>communicable disease, health>diseases and conditions, health>diseases and conditions>illness, health>diseases and conditions>communicable disease>virus disease, health",10.1016/s1473-3099(03)00856-9
who-33d8a89d3f0d52e5db1ee9de2e4989e6,"Weekly Epidemiological Record, 2020, vol. 96, 05/06 [‎full issue]‎",Publication,2021-02-05,https://apps.who.int/iris/handle/10665/339321,,"Monkeypox, Vaccinia, Orthopoxvirus",eng,"science and technology, health>diseases and conditions>communicable disease, science and technology>natural science, health>diseases and conditions>illness, health>diseases and conditions, health>diseases and conditions>communicable disease>virus disease, science and technology>natural science>biology, health",10.1016/s1473-3099(03)00856-9
who-9281e3292cca1e6dbbc5ba16c38215e4,Case report of laboratory-acquired vaccinia virus infection in India – Cas d’infection en laboratoire par le virus de la vaccine en Inde,Publication,2021-02-05,https://apps.who.int/iris/handle/10665/339331,,"Vaccinia, Smallpox vaccine, Cowpox",eng,"health>diseases and conditions>communicable disease, health>diseases and conditions>illness, health>diseases and conditions, health>diseases and conditions>communicable disease>virus disease, health",10.1016/s1473-3099(03)00856-9
ecdc-222eaf4309a3b2b0504f2a6caea942fb,"Rapid risk assessment: Monkeypox cases in the UK imported by travellers returning from Nigeria, 2018",Publication,2018-09-21,https://www.ecdc.europa.eu/en/publications-data/rapid-risk-assessment-monkeypox-cases-uk-imported-travellers-returning-nigeria,,"Monkeypox, Orthopoxvirus, Infection",eng,"health>diseases and conditions, health>diseases and conditions>communicable disease>virus disease, health, health>diseases and conditions>illness, health>diseases and conditions>communicable disease",10.1016/s1473-3099(03)00856-9
