unique_identifier,title,document_type,published_on,document_url,source_specific_tags,top_topics,languages,document_theme,first_order_doi
cadth-7b34db4b8a72da63f5ca983f6728965b,Treatment of Smallpox: Clinical Effectiveness and Guidelines,Clinical guidance,2009-08-06,https://cadth.ca/treatment-smallpox-clinical-effectiveness-and-guidelines-0,,"Vaccination, Infection, Clinical trial",eng,"health>diseases and conditions, health>diseases and conditions>communicable disease, health, health>diseases and conditions>communicable disease>virus disease, health>diseases and conditions>communicable disease>virus disease>retrovirus, health>health treatment>preventative medicine, health>health treatment, health>health treatment>preventative medicine>vaccines",10.1016/s0140-6736(06)68143-9
marylandgov-9dcb5f50bb85c5f23d19141b74d90842,Genetically modified organism,Publication,2024-02-27,https://mgaleg.maryland.gov/cmte_testimony/2024/hgo/1vv9HYR9T3AlwxGT806LPji9R0wYHBAF-.pdf,,"Genetically modified organism, Genetic engineering, Genetically modified bacteria",eng,"health, health>diseases and conditions>communicable disease, science and technology>natural science>biology, science and technology>natural science, science and technology>natural science>biology>genetics, health>diseases and conditions>communicable disease>virus disease, science and technology, health>diseases and conditions",10.1128/cmr.00014-08
who-72961fcbb7730ad23ded8df4d8f2d0d8,LABORATORY BIOSAFETY MANUAL FOURTH EDITION AND COMPLEMENTARY MONOGRAPHS,Publication,2023-01-17,https://apps.who.int/iris/handle/10665/365600,,"Autoclave, Laboratory, Risk",spa,"lifestyle and leisure, lifestyle and leisure>lifestyle, science and technology>natural science, health>diseases and conditions, health, science and technology, science and technology>natural science>biology, lifestyle and leisure>lifestyle>food and drink",10.1128/cmr.00014-08
who-69de38ceb3f47eba7e19ee72b243b70f,fourth edition,Publication,2023-01-17,https://apps.who.int/iris/handle/10665/365602,,"Risk, Tobacco smoking, Disease",rus,"health>diseases and conditions>communicable disease, health>health treatment, society, society>values, health>diseases and conditions, health, science and technology, health>health treatment>medicine, health>diseases and conditions>communicable disease>virus disease, society>values>ethics",10.1128/cmr.00014-08
who-80e0675b6945fc749fd8c4fda05ad72f,Laboratory Biological Safety Manual,Publication,2023-01-01,https://apps.who.int/iris/handle/10665/374880,1. Headquarters,"Risk, Autoclave, Infection",fre,"economy, business and finance, economy, business and finance>economic sector, science and technology>natural science, health, science and technology, health>diseases and conditions, economy, business and finance>economic sector>computing and information technology, science and technology>natural science>biology",10.1128/cmr.00014-08
governmentofperu-3c708e1b972a246e9e6c288183e5767a,Laboratory Biosafety Manual Fourth Edition,Publication,2022-03-01,https://www.minsa.gob.pe/Recursos/OTRANS/08Proyectos/2022/Manual%20de%20Bioseguridad%20OMS.pdf,,"Laboratory, Autoclave, Sterilization (microbiology)",spa,"science and technology>natural science, health>health treatment, health>diseases and conditions, health, science and technology, science and technology>natural science>biology, health>health treatment>medicine",10.1128/cmr.00014-08
governmentofperu-a872b1e342c64563cd7cf5c989529cf3,Laboratory Biosafety Manual Fourth Edition,Publication,2022-03-01,https://www.minsa.gob.pe/Recursos/OTRANS/08Proyectos/2023/nsec/Manual%20de%20Bioseguridad%20OMS.pdf,,"Laboratory, Autoclave, Sterilization (microbiology)",spa,"science and technology>natural science, health>health treatment, health>diseases and conditions, health, science and technology, science and technology>natural science>biology, health>health treatment>medicine",10.1128/cmr.00014-08
who-377e9fef147d59fb34ca15792f40607c,4th ed,Publication,2020-12-21,https://apps.who.int/iris/handle/10665/337956,,"Biosafety, Risk, Risk assessment",eng,"science and technology>natural science, health>diseases and conditions, science and technology>natural science>biology, health, science and technology, science and technology>natural science>biology>genetics",10.1128/cmr.00014-08
govsg-b08e16acc7c5cfebcb3f746607fab9b1,Laboratory Biosafety Manual Fourth Edition,Publication,2020-12-17,https://www.moh.gov.sg/docs/librariesprovider7/useful-info-and-guidelines-documents/who_lbsm_4ed.pdf?sfvrsn=f7204827_2,,"Biosafety, Autoclave, Risk assessment",eng,"science and technology>natural science, health>diseases and conditions, science and technology>natural science>biology, health, science and technology",10.1128/cmr.00014-08
governmentofperu-4a300594e25ea7923eae6b16d840da8b,Biosafety in Microbiological and Biomedical Laboratories—6th Edition,Publication,2020-12-11,https://www.minsa.gob.pe/Recursos/OTRANS/08Proyectos/2022/Biosafety%20in%20Microbiological%20and%20Biomedical%20Laboratories%206th%20edition.pdf,,"Biocontainment, Biosafety level, Biosafety",eng,"science and technology, health>diseases and conditions>communicable disease, science and technology>natural science, health>diseases and conditions>communicable disease>virus disease, health>diseases and conditions, health>diseases and conditions>illness, science and technology>natural science>biology, health",10.1128/cmr.00014-08
governmentofperu-86bca9185ca1db6c6fb8e73f804879d7,Biosafety in Microbiological and Biomedical Laboratories—6th Edition,Publication,2020-12-11,https://www.minsa.gob.pe/Recursos/OTRANS/08Proyectos/2023/nsec/Biosafety%20in%20Microbiological%20and%20Biomedical%20Laboratories%206th%20edition.pdf,,"Biocontainment, Biosafety level, Biosafety",eng,"science and technology, health>diseases and conditions>communicable disease, science and technology>natural science, health>diseases and conditions>communicable disease>virus disease, health>diseases and conditions, health>diseases and conditions>illness, science and technology>natural science>biology, health",10.1128/cmr.00014-08
govsg-4a5384ac8a0ca17eb508dd56352f2dc7,Biosafety in Microbiological and Biomedical,Publication,2020-11-19,https://www.moh.gov.sg/docs/librariesprovider7/useful-info-and-guidelines-documents/bmbl.pdf?sfvrsn=a55c1973_4,,"Biosafety level, Biocontainment, Biosafety",eng,"science and technology, health>diseases and conditions>communicable disease, science and technology>natural science, health>diseases and conditions>communicable disease>virus disease, health>diseases and conditions>illness, health>diseases and conditions, science and technology>natural science>biology, health",10.1128/cmr.00014-08
sciensano-2dd727d1a148f8812433a376578ca882,Monitoring of Laboratory-Acquired Infections,Clinical guidance,2018-03-29,https://www.sciensano.be/en/biblio/monitoring-laboratory-acquired-infections,,"Post-exposure prophylaxis, Biosafety, Occupational safety and health",eng,"science and technology>natural science, health>diseases and conditions, health>diseases and conditions>communicable disease>virus disease, health, science and technology>natural science>biology, science and technology, health>diseases and conditions>communicable disease",10.1128/cmr.00014-08
who-6539f348416d91be05193bf81b26218b,"Biosafety for human health and the environment in the context of the potential use of genetically modified mosquitoes (‎GMMs)‎: a tool for biosafety training based on courses in Africa, Asia and Latin America, 2008-2011",Publication,2015-07-20,https://apps.who.int/iris/handle/10665/180388,,"DDT, Arbovirus, Mosquito-borne disease",eng,"science and technology>natural science, health>diseases and conditions, health>diseases and conditions>communicable disease>virus disease, health, science and technology>natural science>biology, science and technology, health>diseases and conditions>communicable disease",10.1128/cmr.00014-08
provinceofquebec-2422f747815e6f10f17c297a74e102c4,Medical Biology Laboratory Unit - Real Estate Planning Guides Directory - Short-Term Care Hospitals,Publication,2014-08-19,https://publications.msss.gouv.qc.ca/msss/fichiers/2014/14-610-05W.pdf,,"Anatomical pathology, Medical laboratory, Genetics",fre,"economy, business and finance, economy, business and finance>economic sector, science and technology>natural science>biology, science and technology>natural science, science and technology>natural science>biology>genetics, health, science and technology, economy, business and finance>economic sector>computing and information technology, health>diseases and conditions",10.1128/cmr.00014-08
hcspfr-974b3fabbbd1b7636ca28613d494a97b,What to do in the case of suspected cases of Ebola haemorrhagic fever,Publication,2014-04-10,https://www.hcsp.fr/Explore.cgi/avisrapportsdomaine?clefr=414,,"Ebola, Serology, Microbiology",fre,"health, health>diseases and conditions, health>diseases and conditions>illness, health>diseases and conditions>communicable disease",10.1128/cmr.00014-08
marylandgov-1141cfe0fbd2fce5a176e45ba8292365,Maryland Department of Health and Mental Hygiene,Publication,2013-11-01,https://msa.maryland.gov/megafile/msa/speccol/sc5300/sc5339/000113/018000/018731/unrestricted/20132793e.pdf,,"Biosafety level, Biocontainment, Biosafety",eng,"health>diseases and conditions>illness, health>diseases and conditions>communicable disease>virus disease, health>diseases and conditions, health, health>diseases and conditions>communicable disease",10.1128/cmr.00014-08
sipri-b9d74b9467435fef7ae835f6ee3ae0c7,Strengthening the BTWC through laboratory best practices and biosecurity,Publication,2011-12-01,https://www.sipri.org/publications/2011/eu-non-proliferation-papers/strengthening-btwc-through-laboratory-best-practices-and-biosecurity,,"Biosecurity, Biosafety, Biological Weapons Convention",eng,"health>diseases and conditions, health>diseases and conditions>communicable disease, science and technology>natural science, science and technology>natural science>biology, health, society, education, science and technology, health>diseases and conditions>communicable disease>virus disease, health>diseases and conditions>communicable disease>virus disease>retrovirus",10.1128/cmr.00014-08
iaiit-dbf9231ed7f9d6c460d66adeec4a357b,EU-U.S. Security Strategies,Publication,2011-04-27,https://www.iai.it/en/pubblicazioni/eu-us-security-strategies,,"Biosecurity, Influenza pandemic, Biosafety",eng,"crime, law and justice, disaster, accident and emergency incident, health>diseases and conditions, health, disaster, accident and emergency incident>disaster, crime, law and justice>crime, science and technology, conflicts, war and peace, conflicts, war and peace>armed conflict",10.1128/cmr.00014-08
dhsgov-7ef12121c9f3f2cad0acfdac6c278989,NBAF SSRA Final Report,Publication,2010-11-12,https://www.dhs.gov/xlibrary/assets/nbaf_ssra_final_report.pdf,,"Plum Island Animal Disease Center, Foreign animal disease, Biosafety",eng,"health>diseases and conditions, health, science and technology, environment, health>diseases and conditions>communicable disease, science and technology>social sciences, health>diseases and conditions>communicable disease>virus disease",10.1128/cmr.00014-08
robertkochde-a2acaa3d4a5be4e3a060196f2b7a197d,Notes on the Treatment of Monkeypox,Clinical guidance,2022-05-27,http://edoc.rki.de/176904/9881.11,"Amtliche Bekanntmachungen/Kommissionsveröffentlichungen, Article, Bekanntmachungen des Robert Koch-Instituts, DDC 610, Open Access Set, Primus Set, published version, textPublication","Clinical medicine, Microbiology, Public health",ger,"health>diseases and conditions>illness, health>diseases and conditions, health",10.1128/aac.00762-07
tabde-d5c66a1587b61e8b39c2be111b3a2c40,Synthetic Biology - the next level of biotechnology and genetic engineering,Publication,2015-12-01,http://www.tab-beim-bundestag.de/de/pdf/publikationen/berichte/TAB-Arbeitsbericht-ab164.pdf,,"Nature, Artificial objects, Synthetic biology",ger,"economy, business and finance, economy, business and finance>economic sector, science and technology>natural science>biology, science and technology, economy, business and finance>economic sector>chemicals, science and technology>natural science>biology>genetics, science and technology>natural science, environment, environment>natural resources",10.1016/j.febslet.2012.02.022
santafeinstitute-a28b9ac5d0078ca765d18d47faba5e3a,Bioengineering the Biosphere?,Working paper,2014-11-03,https://sfi-edu.s3.amazonaws.com/sfi-edu/production/uploads/sfi-com/dev/uploads/filer/bc/f0/bcf0cec9-3567-4d95-a3e7-870d6de0ba9b/14-10-039.pdf,,"Nature, Earth sciences, Natural environment",eng,"environment>natural resources, environment>nature, science and technology>natural science>biology, science and technology>natural science, science and technology>natural science>biology>genetics, environment, science and technology, environment>nature>ecosystem, science and technology>natural science>biology>physiology, environment>natural resources>water",10.1016/j.febslet.2012.02.022
cadth-f79856adec32b2016108d945430eac98,Tecovirimat for the Treatment of Human Monkeypox,Clinical guidance,2022-09-28,https://www.cda-amc.ca/tecovirimat-treatment-human-monkeypox,,"Post-exposure prophylaxis, Immunodeficiency, Orthopoxvirus",eng,"health, science and technology, science and technology>biomedical science, health>diseases and conditions, health>diseases and conditions>illness, science and technology>biomedical science>pharmacology",10.1128/jvi.02012-09
who-25056a260c8623d87f02039de1a8d8aa,"WHO Independent Experts Advisory Panel on the Research on the Smallpox Research Program (AGIES): Comments on the Scientific Review of the Smallpox Virus Research, 1999–2010.",Publication,2013-09-02,https://apps.who.int/iris/handle/10665/87130,,"Virus, Smallpox, Vaccine",rus,"health>diseases and conditions, health>diseases and conditions>communicable disease, science and technology>natural science>biology, health, health>diseases and conditions>communicable disease>virus disease, science and technology>natural science>biology>genetics, science and technology, health>diseases and conditions>communicable disease>virus disease>retrovirus, science and technology>natural science",10.1128/jvi.02012-09
who-1396342e1ed866b28eba7c590455da46,Scientific review of research on smallpox virus,Publication,2013-08-02,https://apps.who.int/iris/handle/10665/85634,,,eng,,10.1128/jvi.02012-09
who-5d848d8b5939c3ae2ef27e7354be4664,"Advisory Group of Independent Experts to review the smallpox research programme (‎AGIES)‎: comments on the scientific review of variola virus research, 1999-2010",Publication,2012-06-17,https://apps.who.int/iris/handle/10665/70509,,"Genomics, Virus, Smallpox",rus,"health>diseases and conditions, health>diseases and conditions>communicable disease, science and technology>natural science>biology, health, health>diseases and conditions>communicable disease>virus disease, science and technology>natural science>biology>genetics, science and technology, health>diseases and conditions>communicable disease>virus disease>retrovirus, science and technology>natural science",10.1128/jvi.02012-09
who-cab07fdd4652f4f41886accfd0785672,"Scientific review of variola virus research, 1999-2010",Publication,2012-06-17,https://apps.who.int/iris/handle/10665/70610,,"Medical specialties, Biology, Biotechnology",spa,"health, health>diseases and conditions, health>diseases and conditions>communicable disease, health>diseases and conditions>communicable disease>virus disease, science and technology>natural science>biology, science and technology, science and technology>natural science, science and technology>natural science>biology>genetics, health>diseases and conditions>communicable disease>virus disease>retrovirus, health>diseases and conditions>communicable disease>epidemic",10.1128/jvi.02012-09
who-630c28ebbbc346baaef1618a7d4e6e03,"WHO Independent Expert Advisory Group to Review the Smallpox Program (AGIES): Comments on the Scientific Review of Variola Virus Research, 1999-2010",Publication,2012-06-17,https://apps.who.int/iris/handle/10665/70608,,"Virus, Vaccine, Smallpox",spa,"health, health>diseases and conditions, health>diseases and conditions>communicable disease>virus disease, science and technology>natural science>biology, science and technology>natural science, health>diseases and conditions>communicable disease>virus disease>retrovirus, health>diseases and conditions>communicable disease, science and technology",10.1128/jvi.02012-09
who-b3e4649291eba339532dcb31aa2fe308,"Consultative Group of Independent Experts to Review the Smallpox Research Program (AGIES): Observations on the Scientific Analysis of Research on Smallpox Virus, 1999-2010",Publication,2012-06-17,https://apps.who.int/iris/handle/10665/70607,,"Genetically modified organism, Dengue fever, Antibody",fre,"health, health>diseases and conditions, health>diseases and conditions>communicable disease, health>diseases and conditions>communicable disease>virus disease, health>diseases and conditions>communicable disease>virus disease>retrovirus, science and technology>natural science>biology, science and technology, science and technology>natural science, health>diseases and conditions>communicable disease>epidemic, science and technology>natural science>biology>genetics",10.1128/jvi.02012-09
who-39d1147c550a77622ac2df1ebe9d2451,"Scientific analysis of variola virus research, 1999-2010",Publication,2012-06-17,https://apps.who.int/iris/handle/10665/70609,,"Smallpox, Vaccination, Virus",fre,"health, health>diseases and conditions, health>diseases and conditions>communicable disease, health>diseases and conditions>communicable disease>virus disease, health>diseases and conditions>communicable disease>virus disease>retrovirus, science and technology>natural science>biology, science and technology, science and technology>natural science, science and technology>natural science>biology>genetics, health>diseases and conditions>communicable disease>epidemic",10.1128/jvi.02012-09
who-b4072420d0e86f154392a97784590f51,"Scientific review of variola virus research, 1999-2010",Publication,2012-06-17,https://apps.who.int/iris/handle/10665/70508,,,eng,,10.1128/jvi.02012-09
cigi-543dacb4be7ca7631e519327ec2e54d7,Emerging Security Challenges for Canada in the Coming Decade,Publication,2021-10-19,https://www.cigionline.org/publications/emerging-security-challenges-for-canada-in-the-coming-decade/,,"National security, Cyberwarfare, Computer security",eng,"politics, conflicts, war and peace, conflicts, war and peace>armed conflict, politics>government, politics>government>defence",10.1162/isec.2010.34.4.96
sipri-f178fe7df51d22be7ac577b09a12521e,Effective and Comprehensive CBRN Security Risk Management in the 21st Century,Publication,2021-06-01,https://www.sipri.org/publications/2021/eu-non-proliferation-and-disarmament-papers/effective-and-comprehensive-cbrn-security-risk-management-21st-century,,"International relations, International security, Politics",eng,"economy, business and finance, economy, business and finance>economic sector, lifestyle and leisure, lifestyle and leisure>lifestyle, politics, politics>government, politics>government>defence, politics>government>defence>military equipment, conflicts, war and peace, science and technology, politics>government>defence>military equipment>military weaponry, economy, business and finance>economic sector>energy and resource, conflicts, war and peace>armed conflict, lifestyle and leisure>lifestyle>food and drink, health",10.1162/isec.2010.34.4.96
carnegieendowment-0337376623f85070e068b7ef2f5e9d05,Biological Risks in India: Perspectives and Analysis,Publication,2020-12-09,https://carnegieendowment.org/2020/12/09/biological-risks-in-india-perspectives-and-analysis-pub-83399,,"Biosafety, Avian influenza, Biosafety level",eng,"health, health>diseases and conditions>communicable disease, science and technology, science and technology>natural science, health>diseases and conditions>illness, science and technology>natural science>biology>genetics, science and technology>natural science>biology, health>diseases and conditions>communicable disease>virus disease, health>diseases and conditions",10.1162/isec.2010.34.4.96
govdeptsaustria-59443ee6b0e02b83a252c609b8e88c1f,Tomorrow ’ s Technology,Publication,2018-03-22,https://www.bmlv.gv.at/pdf_pool/publikationen/buch_dengg_tomorrows_technology_web.pdf,,"Technology, Brain, Robot",eng,"economy, business and finance, economy, business and finance>economic sector, health, health>diseases and conditions, health>diseases and conditions>communicable disease, science and technology>natural science, science and technology>natural science>biology, science and technology>natural science>biology>genetics, science and technology, economy, business and finance>economic sector>computing and information technology, health>diseases and conditions>communicable disease>virus disease, conflicts, war and peace",10.1162/isec.2010.34.4.96
ecologic-ef609970b2d0ab5fcbf95a2c78e13640,The AQUACROSS Innovative Concept: Science and Policy for a Sustainable World,Publication,2016-02-01,https://www.ecologic.eu/12426,,"Ecosystem services, Ecological resilience, Ecology",eng,"economy, business and finance, economy, business and finance>business information, environment, science and technology, science and technology>social sciences, environment>natural resources, environment>conservation, environment>nature, economy, business and finance>business information>human resources",10.1162/isec.2010.34.4.96
pacforum-661a2366e4775c91b5874f8b65d4b294,Issues & Insights Vol. 13 - No. 8 - Innovate or Enervate: The future of US-Japan alliance collaboration,Publication,2013-07-17,https://www.pacforum.org/analysis/issues-insights-vol-13-no-8-innovate-or-enervate-future-us-japan-alliance-collaboration,,"Human activities, Government, Politics",eng,"conflicts, war and peace, conflicts, war and peace>armed conflict, politics, politics>government, health, politics>government>defence",10.1162/isec.2010.34.4.96
govdeptsspain-a46876418f3e5e1819a0427c6abd06bc,The biological threat. Strategy Notebook 217,Publication,2023-02-14,https://publicaciones.defensa.gob.es/media/downloadable/files/links/l/a/la_amenaza_biologica.pdf,,"Biopreparat, Rickettsia, Bacteria",spa,"science and technology>natural science>biology, science and technology>natural science, health>diseases and conditions, science and technology>natural science>biology>genetics, health>diseases and conditions>illness, science and technology, health",10.1136/jme.2010.038232
nuffbioethics-12fcab33e05b47909dd863d7bf2bec18,Emerging biotechnologies,Publication,2012-12-11,https://www.nuffieldbioethics.org/publications/emerging-biotechnologies,,"Research, Biotechnology, Stem cell",eng,"health, science and technology>natural science, science and technology>natural science>biology, science and technology>natural science>biology>genetics, science and technology, health>diseases and conditions",10.1136/jme.2010.038232
unesco-1313f01632b9888c63edcbb8800f63f1,Draft report of the World Commission on the Ethics of Scientific Knowledge and Technology (COMEST) on revisiting the relationship between science and society in light of the COVID-19 pandemic,Publication,2023-01-01,https://unesdoc.unesco.org/notice?id=p::usmarcdef_0000386678_fre,,"Research, COVID-19 pandemic, Science",fre,"society, society>values, health>diseases and conditions, science and technology, science and technology>social sciences, health, environment, society>values>ethics",10.1007/s11948-016-9810-1
unesco-2539a0380a08f31e6ddf41417c0b3d31,Draft report of the World Commission on the Ethics of Scientific Knowledge and Technology (COMEST) on revisiting the relations between science and society in the light of the COVID-19 pandemic,Publication,2023-01-01,https://unesdoc.unesco.org/notice?id=p::usmarcdef_0000386678,,"Fact, Vaccine, Decision-making",eng,"health, science and technology, science and technology>social sciences, society>values, society, environment, health>diseases and conditions, education",10.1007/s11948-016-9810-1
congressionalresearch-0e02ba39c988aa5fb26e69ead4dd2213,R47114| Oversight of Gain of Function Research with Pathogens: Issues for Congress,Publication,2022-05-26,https://crsreports.congress.gov/product/pdf/download/R/R47114/R47114.pdf/,,"Gain-of-function research, Biosafety level, Biosafety",eng,"health, health>diseases and conditions>communicable disease, science and technology>natural science, science and technology>natural science>biology, health>diseases and conditions>communicable disease>virus disease, health>diseases and conditions, science and technology>natural science>biology>genetics, science and technology",10.1007/s11948-016-9810-1
fcppca-4f0cc887a6635ccb01881809dffd673a,Introductory Comment,Publication,2022-05-11,https://fcpp.org/2022/05/11/report-of-the-covid-commission/,,"Wuhan Institute of Virology, SARS-CoV-2, Biosafety level",eng,"health, health>diseases and conditions>communicable disease, science and technology, science and technology>natural science, science and technology>natural science>biology, health>diseases and conditions>communicable disease>virus disease, health>diseases and conditions>illness, science and technology>natural science>biology>genetics, health>diseases and conditions",10.1007/s11948-016-9810-1
bundestag-8086466b2e56fafc82b6eff0fc215f42,WD 8 - 077/21 Gain-of-Function - Forschung und Dual-Use Research of Concern,Publication,2021-09-23,https://www.bundestag.de/resource/blob/867492/6b63ac17cdf8ff5fb8aa7d2d8c78fe7f/WD-8-077-21-pdf-data.pdf,,"Life sciences, Biology, Health",ger,"health>diseases and conditions>communicable disease, health>health treatment, health, health>diseases and conditions>communicable disease>virus disease, science and technology, health>diseases and conditions, health>health treatment>medicine",10.1007/s11948-016-9810-1
