core_doi,title,publication_date,type,primary_topic.display_name,primary_topic.subfield.display_name,primary_topic.domain.display_name,topics.display_name,topics.field.display_name,topics.domain.display_name,keywords.display_name,concepts.display_name,mesh.descriptor_name,mesh.qualifier_name,first_order_doi
10.1128/jvi.75.3.1205-1210.2001,Regulating dual-use research: Lessons from Israel and the United States,2019-07-10,article,Bacillus and Francisella bacterial research,Molecular Biology,Life Sciences,Bacillus and Francisella bacterial research; Influenza Virus Research Studies,"Biochemistry, Genetics and Molecular Biology; Medicine",Life Sciences; Health Sciences,Strengths and weaknesses,Government (linguistics); Political science; Dual (grammatical number); Strengths and weaknesses; Set (abstract data type); Public relations; Public policy; Public administration; Law and economics; Law; Economics; Computer science; Psychology; Art; Social psychology; Philosophy; Linguistics; Literature; Programming language,,,10.1016/j.jobb.2019.06.001
10.1128/jvi.75.3.1205-1210.2001,Biological control of vertebrate pests using virally vectored immunocontraception,2006-07-26,review,Herpesvirus Infections and Treatments,Epidemiology,Health Sciences,Herpesvirus Infections and Treatments; interferon and immune responses; Aquaculture disease management and microbiota,Medicine; Immunology and Microbiology; Immunology and Microbiology,Health Sciences; Life Sciences; Life Sciences,Porcine parvovirus; Pseudorabies,Biology; Virology; Virus; Porcine parvovirus; Mating; Vertebrate; Pseudorabies; Immunology; Zoology; Genetics; Gene,"Contraception, Immunologic; Genetic Vectors; Pest Control, Biological; Viral Vaccines; Animals; Contraception, Immunologic; Foxes; Mice; Pest Control, Biological; Rabbits; Species Specificity; Viral Vaccines",methods; None; methods; genetics; None; None; None; None; None; None; None; None,10.1016/j.jri.2006.04.006
10.1128/jvi.75.3.1205-1210.2001,Dual-probe real-time PCR assay for detection of variola or other orthopoxviruses with dried reagents,2008-09-11,article,Poxvirus research and outbreaks,Virology,Life Sciences,Poxvirus research and outbreaks; Herpesvirus Infections and Treatments; Bacillus and Francisella bacterial research,"Immunology and Microbiology; Medicine; Biochemistry, Genetics and Molecular Biology",Life Sciences; Health Sciences; Life Sciences,Variola virus; Orthopoxvirus; Poxviridae; Smallpox virus; Cowpox; Monkeypox,Variola virus; Virology; Biology; Orthopoxvirus; Poxviridae; Vaccinia; Nucleic acid; Smallpox virus; Real-time polymerase chain reaction; Cowpox; Virus; Smallpox; Polymerase chain reaction; Molecular biology; Monkeypox; Gene; Vaccination; Biochemistry; Recombinant DNA,DNA Probes; Freeze Drying; Indicators and Reagents; Orthopoxvirus; Polymerase Chain Reaction; Variola virus; Fluoresceins; Fluorescent Dyes; Humans; Orthopoxvirus; Orthopoxvirus; Orthopoxvirus; Polymerase Chain Reaction; Rhodamines; Sensitivity and Specificity; Variola virus; Variola virus; Variola virus,None; None; None; isolation & purification; methods; isolation & purification; None; None; None; genetics; classification; None; None; None; None; classification; genetics; None,10.1016/j.jviromet.2008.07.018
10.1128/jvi.75.3.1205-1210.2001,Dual use beyond the life sciences: An LIS perspective,2015-07-01,article,Research Data Management Practices,Information Systems,Physical Sciences,Research Data Management Practices; Scientific Computing and Data Management; Open Source Software Innovations,Computer Science; Decision Sciences; Computer Science,Physical Sciences; Social Sciences; Physical Sciences,Dual purpose; Dual role; Survey research,Dual (grammatical number); Perspective (graphical); Dual purpose; Sociology; Dual role; Survey research; Engineering ethics; Social science; Computer science; Engineering; Artificial intelligence; Mechanical engineering; Art; Chemistry; Literature; Socioeconomics; Combinatorial chemistry,,,10.1016/j.lisr.2015.04.008
10.1128/jvi.75.3.1205-1210.2001,Gain-of-function and origin of Covid19,2023-03-01,article,SARS-CoV-2 and COVID-19 Research,Infectious Diseases,Health Sciences,SARS-CoV-2 and COVID-19 Research; Viral gastroenteritis research and epidemiology; Animal Virus Infections Studies,Medicine; Medicine; Agricultural and Biological Sciences,Health Sciences; Health Sciences; Life Sciences,Natural reservoir; Pandemic; Coronavirus,Biology; Natural reservoir; Virulence; Outbreak; Virology; Virus; Pandemic; Influenza A virus subtype H5N1; Zoology; Transmission (telecommunications); Coronavirus; Genetics; Gene; Coronavirus disease 2019 (COVID-19); Medicine; Disease; Pathology; Infectious disease (medical specialty); Electrical engineering; Engineering,"COVID-19; Influenza A Virus, H7N9 Subtype; Animals; Furin; Gain of Function Mutation; Humans; Phylogeny; RNA, Viral; SARS-CoV-2",None; None; None; None; None; None; None; None; None,10.1016/j.lpm.2023.104167
10.1128/jvi.75.3.1205-1210.2001,Actualités sur la vaccination antivariolique,2004-01-01,review,Bacillus and Francisella bacterial research,Molecular Biology,Life Sciences,Bacillus and Francisella bacterial research; Hepatitis B Virus Studies; Poxvirus research and outbreaks,"Biochemistry, Genetics and Molecular Biology; Medicine; Immunology and Microbiology",Life Sciences; Health Sciences; Life Sciences,Scarification; SAFER; Smallpox vaccine,Virology; Scarification; Vaccination; Biology; Smallpox; SAFER; Smallpox vaccine; Population; Medicine; Vaccinia; Environmental health; Genetics; Botany; Germination; Dormancy; Gene; Recombinant DNA; Computer security; Computer science,Smallpox; Smallpox Vaccine; Animals; France; Humans; Smallpox; Smallpox; Vaccination; Vaccination,immunology; None; None; None; None; None; prevention & control; None; methods,10.1016/j.medmal.2003.09.007
10.1128/jvi.75.3.1205-1210.2001,La variole et le bioterrorisme,2004-01-01,review,Bacillus and Francisella bacterial research,Molecular Biology,Life Sciences,"Bacillus and Francisella bacterial research; Zoonotic diseases and public health; Yersinia bacterium, plague, ectoparasites research","Biochemistry, Genetics and Molecular Biology; Medicine; Biochemistry, Genetics and Molecular Biology",Life Sciences; Health Sciences; Life Sciences,,Philosophy,Bioterrorism; Smallpox; Humans; Smallpox; Smallpox,None; epidemiology; None; None; prevention & control,10.1016/j.medmal.2003.09.009
10.1128/jvi.75.3.1205-1210.2001,The hidden face of academic researches on classified highly pathogenic microorganisms,2014-11-07,article,Bacillus and Francisella bacterial research,Molecular Biology,Life Sciences,"Bacillus and Francisella bacterial research; Zoonotic diseases and public health; Yersinia bacterium, plague, ectoparasites research","Biochemistry, Genetics and Molecular Biology; Medicine; Biochemistry, Genetics and Molecular Biology",Life Sciences; Health Sciences; Life Sciences,Biosafety; Biosecurity; Decree; Biological Warfare; Suspect; Laboratory Safety,Biosafety; Biosecurity; Government (linguistics); Political science; Decree; Sanctions; Biological warfare; Suspect; Laboratory safety; Business; Law; Public relations; Medicine; Biotechnology; Biology; Linguistics; Philosophy; Pathology; Nuclear medicine,Biomedical Research; Containment of Biohazards; Laboratory Infection; Animals; Biomedical Research; Biomedical Research; Biomedical Research; France; Humans; Laboratories; Laboratories; Laboratory Infection; Laboratory Infection; Medical Laboratory Personnel; Medical Laboratory Personnel; United States,None; None; prevention & control; None; organization & administration; legislation & jurisprudence; trends; None; None; legislation & jurisprudence; None; economics; None; education; None; None,10.1016/j.meegid.2014.10.028
10.1128/jvi.75.3.1205-1210.2001,Expression of interferon gamma by a highly virulent strain of Newcastle disease virus decreases its pathogenicity in chickens,2013-05-24,article,Virology and Viral Diseases,Epidemiology,Health Sciences,Virology and Viral Diseases; Animal Virus Infections Studies; Animal Disease Management and Epidemiology,Medicine; Agricultural and Biological Sciences; Agricultural and Biological Sciences,Health Sciences; Life Sciences; Life Sciences,Newcastle Disease; Pathogenesis; Viral Shedding,Virulence; Biology; Newcastle disease; Virus; Virology; Interferon; Pathogenesis; Cytokine; Interferon gamma; Viral shedding; Microbiology; Immunology; Gene; Biochemistry,Chickens; Interferon-gamma; Newcastle Disease; Newcastle disease virus; Animals; Cell Line; Chickens; Chickens; Fibroblasts; Fibroblasts; Interferon-gamma; Interferon-gamma; Interferon-gamma; Macrophages; Macrophages; Newcastle Disease; Newcastle Disease; Newcastle Disease; Newcastle Disease; Newcastle disease virus; Newcastle disease virus; Virulence; Virus Replication,virology; metabolism; immunology; pathogenicity; None; None; immunology; None; virology; None; genetics; immunology; None; virology; None; mortality; pathology; virology; None; None; immunology; None; None,10.1016/j.micpath.2013.05.009
10.1128/jvi.75.3.1205-1210.2001,Evaluation of chickens infected with a recombinant virulent NDV clone expressing chicken IL4,2021-07-31,article,Virology and Viral Diseases,Epidemiology,Health Sciences,Virology and Viral Diseases; Animal Disease Management and Epidemiology; Virus-based gene therapy research,"Medicine; Agricultural and Biological Sciences; Biochemistry, Genetics and Molecular Biology",Health Sciences; Life Sciences; Life Sciences,Newcastle Disease; Pathogenesis; clone (Java method); Mononegavirales,Biology; Newcastle disease; Virology; Virus; Pathogenesis; clone (Java method); Viral replication; Mononegavirales; Immunology; Paramyxoviridae; Viral disease; Gene; Biochemistry,,,10.1016/j.micpath.2021.105116
10.1128/jvi.75.3.1205-1210.2001,"Biosecurity, bioterrorism and the governance of science: The increasing convergence of science and security policy",2007-11-19,article,Biotechnology and Related Fields,"Public Health, Environmental and Occupational Health",Health Sciences,"Biotechnology and Related Fields; Science, Research, and Medicine; Biomedical and Engineering Education",Medicine; Medicine; Engineering,Health Sciences; Health Sciences; Physical Sciences,Biosecurity; Biological Warfare; Technological convergence; Policy Transfer; Science Policy; Security Policy; Unintended consequences; Research Policy; Technology policy,Biosecurity; Biological warfare; Corporate governance; Technological convergence; Policy transfer; Science policy; Security policy; Convergence (economics); Unintended consequences; Political science; Dual (grammatical number); Terrorism; Research policy; Technology policy; Public relations; Business; Public administration; Sociology; Economics; Social science; Computer science; Computer security; Economic growth; Management; Law; Ecology; Biology; Art; Literature; Operating system,,,10.1016/j.respol.2007.10.003
10.1128/jvi.75.3.1205-1210.2001,A quantitative risk assessment method for synthetic biology products in the environment,2019-08-14,article,CRISPR and Genetic Engineering,Molecular Biology,Life Sciences,CRISPR and Genetic Engineering; Gene Regulatory Network Analysis; Viral Infectious Diseases and Gene Expression in Insects,"Biochemistry, Genetics and Molecular Biology; Biochemistry, Genetics and Molecular Biology; Biochemistry, Genetics and Molecular Biology",Life Sciences; Life Sciences; Life Sciences,Environmental Risk Assessment,Risk assessment; Risk analysis (engineering); Environmental risk assessment; Hazard; Computer science; Biochemical engineering; Management science; Business; Engineering; Biology; Ecology; Computer security,Environment; Synthetic Biology; Risk Assessment; Uncertainty,None; None; None; None,10.1016/j.scitotenv.2019.133940
10.1128/jvi.75.3.1205-1210.2001,Design and development of oral drugs for the prophylaxis and treatment of smallpox infection,2004-07-06,article,Poxvirus research and outbreaks,Virology,Life Sciences,Poxvirus research and outbreaks; Bacillus and Francisella bacterial research; Viral gastroenteritis research and epidemiology,"Immunology and Microbiology; Biochemistry, Genetics and Molecular Biology; Medicine",Life Sciences; Life Sciences; Health Sciences,Variola virus; Smallpox vaccine; Immunosuppression; Smallpox virus,Smallpox; Variola virus; Medicine; Smallpox vaccine; Vaccination; Virology; Immunosuppression; Immunology; Population; Disease; Smallpox virus; Immunity; Outbreak; Intensive care medicine; Vaccinia; Environmental health; Immune system; Biology; Internal medicine; Biochemistry; Gene; Recombinant DNA,Immunosuppression Therapy; Pharmaceutical Preparations; Smallpox; Smallpox Vaccine; Variola virus; Acquired Immunodeficiency Syndrome; Acquired Immunodeficiency Syndrome; Female; Humans; Male; Skin Diseases; Skin Diseases; Smallpox; Smallpox; Smallpox Vaccine; Smallpox Vaccine; Variola virus,None; None; drug therapy; pharmacology; immunology; None; drug therapy; None; None; None; None; drug therapy; None; immunology; administration & dosage; None; None,10.1016/j.tibtech.2004.06.008
10.1128/jvi.75.3.1205-1210.2001,Recombinant viruses obtained from co-infection in vitro with a live vaccinia-vectored influenza vaccine and a naturally occurring cowpox virus display different plaque phenotypes and loss of the transgene,2004-08-05,article,Poxvirus research and outbreaks,Virology,Life Sciences,Poxvirus research and outbreaks; Bacillus and Francisella bacterial research; Herpesvirus Infections and Treatments,"Immunology and Microbiology; Biochemistry, Genetics and Molecular Biology; Medicine",Life Sciences; Life Sciences; Health Sciences,Cowpox virus; Cowpox; Poxviridae; Orthopoxvirus,Cowpox virus; Biology; Virology; Vaccinia; Cowpox; Poxviridae; Orthopoxvirus; Virus; Context (archaeology); Transgene; Influenza A virus; Orthomyxoviridae; Genetically modified organism; Microbiology; Gene; Recombinant DNA; Genetics; Paleontology,"Cowpox virus; Influenza Vaccines; Reassortant Viruses; Vaccinia virus; Viral Vaccines; Animals; Blotting, Southern; Cell Line; Chlorocebus aethiops; Cowpox virus; Cowpox virus; DNA, Viral; DNA, Viral; Influenza Vaccines; Organisms, Genetically Modified; Phenotype; Polymerase Chain Reaction; Reassortant Viruses; Reassortant Viruses; Recombination, Genetic; Vaccinia virus; Vaccinia virus; Vero Cells; Viral Plaque Assay; Viral Vaccines",genetics; None; None; genetics; genetics; None; None; None; None; None; growth & development; isolation & purification; None; genetics; None; None; None; genetics; physiology; None; None; growth & development; None; None; None,10.1016/j.vaccine.2004.06.032
10.1128/jvi.75.3.1205-1210.2001,IL-4 and IL-13 mediated down-regulation of CD8 expression levels can dampen anti-viral CD8+ T cell avidity following HIV-1 recombinant pox viral vaccination,2013-08-06,article,HIV Research and Treatment,Virology,Life Sciences,HIV Research and Treatment; Immune Cell Function and Interaction; T-cell and B-cell Immunology,Immunology and Microbiology; Immunology and Microbiology; Immunology and Microbiology,Life Sciences; Life Sciences; Life Sciences,Avidity,Avidity; Cytotoxic T cell; CD8; Immunology; Biology; T cell; Virology; Vaccination; Antibody; Antigen; Immune system; In vitro; Biochemistry,"AIDS Vaccines; CD8 Antigens; CD8-Positive T-Lymphocytes; HIV-1; Interleukin-13; Interleukin-4; AIDS Vaccines; AIDS Vaccines; Administration, Mucosal; Animals; CD8 Antigens; CD8-Positive T-Lymphocytes; Down-Regulation; Female; HIV-1; Interleukin-13; Interleukin-4; Mice; Mice, Inbred BALB C; Mice, Knockout; Vaccines, Synthetic; Vaccines, Synthetic; Vaccines, Synthetic",immunology; biosynthesis; immunology; immunology; immunology; immunology; None; administration & dosage; None; None; None; None; None; None; None; None; None; None; None; None; None; administration & dosage; immunology,10.1016/j.vaccine.2013.07.062
10.1128/jvi.75.3.1205-1210.2001,Novel HIV IL-4R antagonist vaccine strategy can induce both high avidity CD8 T and B cell immunity with greater protective efficacy,2014-08-20,article,Immune Cell Function and Interaction,Immunology,Life Sciences,Immune Cell Function and Interaction; T-cell and B-cell Immunology; Animal Disease Management and Epidemiology,Immunology and Microbiology; Immunology and Microbiology; Agricultural and Biological Sciences,Life Sciences; Life Sciences; Life Sciences,HIV vaccine; Avidity; Priming (agriculture),HIV vaccine; Avidity; Vaccinia; Virology; Immunology; Priming (agriculture); Biology; CD8; Adjuvant; Vaccination; Antibody; Immune system; Vaccine trial; Recombinant DNA; Biochemistry; Botany; Germination; Gene,"AIDS Vaccines; B-Lymphocytes; CD8-Positive T-Lymphocytes; HIV Infections; Receptors, Interleukin-4; AIDS Vaccines; Adjuvants, Immunologic; Adjuvants, Immunologic; Animals; B-Lymphocytes; CD8-Positive T-Lymphocytes; Female; HIV Antibodies; HIV Antibodies; HIV Antibodies; HIV Infections; Immunoglobulin Class Switching; Immunoglobulin G; Immunoglobulin G; Immunoglobulin G; Immunologic Memory; Interferon-gamma; Interferon-gamma; Interleukin-13; Interleukin-13; Interleukin-2; Interleukin-2; Interleukin-4; Interleukin-4; Mice, Inbred BALB C; Protein Precursors; Protein Precursors; Receptors, Interleukin-4; Tumor Necrosis Factor-alpha; Tumor Necrosis Factor-alpha",immunology; immunology; immunology; prevention & control; antagonists & inhibitors; None; None; pharmacology; None; None; None; None; None; immunology; blood; None; None; None; immunology; blood; None; None; immunology; None; immunology; immunology; None; immunology; None; None; immunology; None; None; immunology; None,10.1016/j.vaccine.2014.08.023
10.1128/jvi.75.3.1205-1210.2001,Unique safety issues associated with virus-vectored vaccines: Potential for and theoretical consequences of recombination with wild type virus strains,2016-06-25,review,SARS-CoV-2 and COVID-19 Research,Infectious Diseases,Health Sciences,SARS-CoV-2 and COVID-19 Research; Animal Virus Infections Studies; Viral Infections and Immunology Research,Medicine; Agricultural and Biological Sciences; Medicine,Health Sciences; Life Sciences; Health Sciences,Attenuated vaccine; Recombinant virus; Virus classification,Virus; Virology; Biology; Vector (molecular biology); Context (archaeology); Recombination; Attenuated vaccine; Recombinant virus; Virus classification; Genetics; Virulence; Recombinant DNA; Genome; Gene; Paleontology,"Drug Carriers; Genetic Vectors; Recombination, Genetic; Viral Vaccines; Viral Vaccines; Animals; Humans; Vaccines, Attenuated; Vaccines, Attenuated; Vaccines, Attenuated; Viral Vaccines; Virulence; Viruses",None; None; None; adverse effects; genetics; None; None; genetics; None; adverse effects; None; None; None,10.1016/j.vaccine.2016.04.060
10.1128/jvi.75.3.1205-1210.2001,Dual use issues in research – A subject of increasing concern?,2017-08-20,review,Bacillus and Francisella bacterial research,Molecular Biology,Life Sciences,Bacillus and Francisella bacterial research; Viral Infections and Outbreaks Research; Biomedical and Engineering Education,"Biochemistry, Genetics and Molecular Biology; Medicine; Engineering",Life Sciences; Health Sciences; Physical Sciences,Emerging Technologies; Bioethics,Dual (grammatical number); Subject (documents); Engineering ethics; Computer science; Risk analysis (engineering); Emerging technologies; Ethical issues; Bioethics; Data science; Management science; Political science; Business; Engineering; Law; Artificial intelligence; Art; Literature; Library science,Biological Science Disciplines; Biomedical Research; Bioterrorism; Animals; Biological Science Disciplines; Biomedical Research; Bioterrorism; Humans,legislation & jurisprudence; legislation & jurisprudence; legislation & jurisprudence; None; None; None; None; None,10.1016/j.vaccine.2017.07.109
10.1128/jvi.75.3.1205-1210.2001,Use of feline herpesvirus as a vaccine vector offers alternative applications for feline health,2021-08-16,review,Herpesvirus Infections and Treatments,Epidemiology,Health Sciences,Herpesvirus Infections and Treatments; Virus-based gene therapy research; Toxoplasma gondii Research Studies,"Medicine; Biochemistry, Genetics and Molecular Biology; Immunology and Microbiology",Health Sciences; Life Sciences; Life Sciences,Animal health,Virology; Biology; Vector (molecular biology); Viral vector; Animal health; Computational biology; Recombinant DNA; Genetics; Gene; Animal science,"Cat Diseases; Genetic Vectors; Immunization; Varicellovirus; Animals; Cat Diseases; Cat Diseases; Cat Diseases; Cats; Genetic Vectors; Genetic Vectors; Immunization; Vaccines, Synthetic; Vaccines, Synthetic; Varicellovirus; Varicellovirus",prevention & control; standards; veterinary; immunology; None; immunology; None; virology; None; None; genetics; None; None; immunology; None; genetics,10.1016/j.vetmic.2021.109210
10.1128/jvi.75.3.1205-1210.2001,Expression of rabbit IL-4 by recombinant myxoma viruses enhances virulence and overcomes genetic resistance to myxomatosis,2004-05-08,article,Plant Virus Research Studies,Plant Science,Life Sciences,Plant Virus Research Studies; Animal Disease Management and Epidemiology; Plant and Fungal Interactions Research,"Agricultural and Biological Sciences; Agricultural and Biological Sciences; Biochemistry, Genetics and Molecular Biology",Life Sciences; Life Sciences; Life Sciences,Myxomatosis; Myxoma virus; Attenuated vaccine,Myxomatosis; Myxoma virus; Virulence; Biology; Virology; Virus; Attenuated vaccine; Immunity; Immune system; Microbiology; Immunology; Gene; Genetics,"Interleukin-4; Myxoma virus; Myxomatosis, Infectious; Animals; Cell Line; Interleukin-4; Interleukin-4; Myxoma virus; Myxoma virus; Myxomatosis, Infectious; Myxomatosis, Infectious; Rabbits; Virulence",genetics; genetics; immunology; None; None; None; biosynthesis; pathogenicity; None; genetics; None; None; None,10.1016/j.virol.2004.02.031
10.1128/jvi.75.3.1205-1210.2001,Enhanced humoral HIV-1-specifc immune responses generated from recombinant rhabdoviral-based vaccine vectors co-expressing HIV-1 proteins and IL-2,2005-10-15,article,Rabies epidemiology and control,Virology,Life Sciences,Rabies epidemiology and control; Virology and Viral Diseases; Viral Infections and Outbreaks Research,Immunology and Microbiology; Medicine; Medicine,Life Sciences; Health Sciences; Health Sciences,HIV Antigens; Seroconversion,Biology; Virology; Immune system; Recombinant DNA; Antigen; HIV Antigens; Seroconversion; Antibody; Virus; Immunology; Gene; Viral disease; Genetics,"AIDS Vaccines; HIV Antigens; HIV-1; Interleukin-2; Rhabdoviridae; AIDS Vaccines; AIDS Vaccines; Animals; Cell Line; Cell Proliferation; Female; Gene Products, env; Gene Products, env; Gene Products, env; Gene Products, gag; Gene Products, gag; Gene Products, gag; Genetic Vectors; Genetic Vectors; HIV Antigens; HIV Antigens; HIV-1; HIV-1; Interleukin-2; Interleukin-2; Interleukin-4; Interleukin-4; Mice; Rhabdoviridae; Vaccines, Synthetic; Vaccines, Synthetic; Vaccines, Synthetic",immunology; immunology; immunology; immunology; genetics; genetics; None; None; None; None; None; None; immunology; genetics; genetics; immunology; None; genetics; None; None; genetics; None; genetics; None; genetics; None; immunology; None; None; None; genetics; immunology,10.1016/j.virol.2005.09.004
10.1128/jvi.75.3.1205-1210.2001,Interferon-γ and interleukin-4 downregulate expression of the SARS coronavirus receptor ACE2 in Vero E6 cells,2006-07-25,article,SARS-CoV-2 and COVID-19 Research,Infectious Diseases,Health Sciences,SARS-CoV-2 and COVID-19 Research; COVID-19 Clinical Research Studies; Animal Virus Infections Studies,Medicine; Medicine; Agricultural and Biological Sciences,Health Sciences; Health Sciences; Life Sciences,Vero cell; Coronavirus; Angiotensin-converting enzyme 2,Vero cell; Biology; Downregulation and upregulation; Virology; Coronavirus; Interferon; Viral replication; Receptor; Interferon gamma; Angiotensin-converting enzyme 2; Interleukin; Molecular biology; Immunology; Cytokine; Virus; Gene; Coronavirus disease 2019 (COVID-19); Medicine; Internal medicine; Biochemistry; Disease; Infectious disease (medical specialty),"Antiviral Agents; Interferon-gamma; Interleukin-4; Receptors, Virus; SARS Virus; Animals; Antiviral Agents; Chlorocebus aethiops; Dose-Response Relationship, Drug; Down-Regulation; Interferon-gamma; Interleukin-4; Receptors, Virus; Receptors, Virus; SARS Virus; Severe Acute Respiratory Syndrome; Severe Acute Respiratory Syndrome; Time Factors; Vero Cells; Vero Cells; Vero Cells; Virus Replication; Virus Replication",pharmacology; pharmacology; pharmacology; metabolism; physiology; None; None; None; None; None; None; None; None; drug effects; None; None; virology; None; None; metabolism; drug effects; None; drug effects,10.1016/j.virol.2006.06.011
