unique_identifier,title,document_type,published_on,document_url,source_specific_tags,top_topics,languages,document_theme,first_order_doi
cset-fa35074ced836206f93ab080d217c1dc,Anticipating Biological Risk: A Toolkit for Strategic Biosecurity Policy | Center for Security and Emerging Technology,Publication,2024-12-01,https://cset.georgetown.edu/publication/anticipating-biological-risk-a-toolkit-for-strategic-biosecurity-policy/,,"Biocontainment, Biosafety, Biosecurity",eng,"economy, business and finance, economy, business and finance>economic sector, health, science and technology>natural science, science and technology>natural science>biology, science and technology>natural science>biology>genetics, science and technology, health>diseases and conditions, economy, business and finance>economic sector>computing and information technology",10.1128/jvi.01791-23
sdscau-dc3fab4a6b2ee57bce58eb27c2152f97,Biological Weapons: An Overview of Threats and Responses,Publication,2013-04-17,http://sdsc.bellschool.anu.edu.au/experts-publications/publications/3094/biological-weapons-overview-threats-and-responses,,"Biological warfare, Weapon of mass destruction, Nuclear weapon",eng,"politics, politics>government, science and technology>natural science, health>diseases and conditions, health, conflicts, war and peace, science and technology, science and technology>natural science>biology, conflicts, war and peace>armed conflict, politics>government>defence, education",10.1162/01622880260553642
cgiar-d5c227a956c5c93cf7acdf613010a8e8,Revised Full Proposal,Publication,2015-01-23,https://hdl.handle.net/10947/3603,"CGIAR Consortium, CGIAR Fund Council, CGIAR Fund Council Meetings - agenda documents, CGIAR historic archive","Food security, Malnutrition, Health",eng,"economy, business and finance, economy, business and finance>economic sector, economy, business and finance>economic sector>consumer goods, health>health treatment, lifestyle and leisure, lifestyle and leisure>lifestyle, lifestyle and leisure>lifestyle>food and drink, health>diseases and conditions, health>health treatment>diet, economy, business and finance>economic sector>consumer goods>food, health",10.1186/1471-2180-5-19
cgiar-6e130c1c366621ae18a93e58497191e7,CGIAR Research Program on Agriculture for Nutrition and Health,Publication,2012-04-24,https://hdl.handle.net/10947/2562,"CGIAR Research Program on Agriculture for Nutrition and Health, CGIAR Research Programs and Platforms (2012–2021), CGIAR Research Programs and Platforms - management and governance, CGIAR Research Programs phase 1 - proposals, CRP A4NH outputs","Malnutrition, Health, CGIAR",eng,"economy, business and finance, economy, business and finance>economic sector, economy, business and finance>economic sector>consumer goods, health>health treatment, lifestyle and leisure, lifestyle and leisure>lifestyle, lifestyle and leisure>lifestyle>food and drink, economy, business and finance>economic sector>consumer goods>food, health>health treatment>diet, health, health>diseases and conditions",10.1186/1471-2180-5-19
cgiar-b5be7b2feeac2dff45b4a1476451249f,CGIAR Research Program 4: Agriculture for Improved Nutrition and Health,Publication,2012-01-03,https://hdl.handle.net/10947/5322,"CGIAR Research Program on Agriculture for Nutrition and Health, CGIAR Research Programs and Platforms (2012–2021), CGIAR Research Programs and Platforms - management and governance, CGIAR Research Programs phase 1 - proposals, CRP A4NH outputs","Malnutrition, Health, CGIAR",eng,"economy, business and finance, economy, business and finance>economic sector, economy, business and finance>economic sector>consumer goods, health>health treatment, lifestyle and leisure, lifestyle and leisure>lifestyle, lifestyle and leisure>lifestyle>food and drink, economy, business and finance>economic sector>consumer goods>food, health>health treatment>diet, health, health>diseases and conditions",10.1186/1471-2180-5-19
defrauk-69886e2f63199c5b07e948064d4f910d,Desk study to review environmental risks from marketing GM veterinary and human medicines,Publication,2009-03-10,http://cdm21006.contentdm.oclc.org/cdm/ref/collection/p21006coll3/id/2274,Science_Search_Collection,"Viral vector, Angiogenesis, Vectors in gene therapy",eng,"health, health>diseases and conditions>communicable disease, science and technology>natural science>biology, science and technology, science and technology>natural science, science and technology>natural science>biology>genetics, health>diseases and conditions>communicable disease>virus disease, health>diseases and conditions, health>diseases and conditions>illness",10.1586/14760584.4.1.63
who-1396342e1ed866b28eba7c590455da46,Scientific review of research on smallpox virus,Publication,2013-08-02,https://apps.who.int/iris/handle/10665/85634,,,eng,,10.1016/j.tibtech.2004.06.008
who-cab07fdd4652f4f41886accfd0785672,"Scientific review of variola virus research, 1999-2010",Publication,2012-06-17,https://apps.who.int/iris/handle/10665/70610,,"Virus, Edward Jenner, DNA",spa,"health, health>diseases and conditions, health>diseases and conditions>communicable disease, health>diseases and conditions>communicable disease>virus disease, science and technology>natural science>biology, science and technology, science and technology>natural science, science and technology>natural science>biology>genetics, health>diseases and conditions>communicable disease>virus disease>retrovirus, health>diseases and conditions>communicable disease>epidemic",10.1016/j.tibtech.2004.06.008
who-39d1147c550a77622ac2df1ebe9d2451,"Scientific analysis of variola virus research, 1999-2010",Publication,2012-06-17,https://apps.who.int/iris/handle/10665/70609,,"Smallpox, Vaccination, Virus",fre,"health, health>diseases and conditions, health>diseases and conditions>communicable disease, health>diseases and conditions>communicable disease>virus disease, health>diseases and conditions>communicable disease>virus disease>retrovirus, science and technology>natural science>biology, science and technology, science and technology>natural science, science and technology>natural science>biology>genetics, health>diseases and conditions>communicable disease>epidemic",10.1016/j.tibtech.2004.06.008
who-b4072420d0e86f154392a97784590f51,"Scientific review of variola virus research, 1999-2010",Publication,2012-06-17,https://apps.who.int/iris/handle/10665/70508,,,eng,,10.1016/j.tibtech.2004.06.008
auschiefscientist-d72ae8a91a6f06d6729922f1162cc237,Indoor air quality impact on viral transmission,Publication,2024-08-06,https://www.chiefscientist.gov.au/news-and-media/indoor-air-quality-impact-viral-transmission,,"Heating, ventilation, and air conditioning, Ventilation (architecture), Indoor air quality",eng,"health>diseases and conditions, health, science and technology, environment>environmental pollution, health>diseases and conditions>illness, environment",10.1128/aem.00110-07
healthprotectionscotland-da8f2a9994a2f7df2ba5064114843487,Literature Review and Practice Recommendations: Existing and emerging technologies used for decontamination of the healthcare environment - UV light,Clinical guidance,2016-12-15,https://hps.scot.nhs.uk/web-resources-container/literature-review-and-practice-recommendations-existing-and-emerging-technologies-used-for-decontamination-of-the-healthcare-environment-uv-light/,,"Ultraviolet, Disinfectant, Infection prevention and control",eng,"health>diseases and conditions, health>diseases and conditions>communicable disease, health, science and technology, health>diseases and conditions>communicable disease>virus disease",10.1128/aem.00110-07
govuk-734d0b307f64d3768812456ce4dba4a0,Genetically Modified Organisms: Bavarian Nordic Inc. (11/R44/01),Publication,2015-02-04,https://www.gov.uk/government/publications/genetically-modified-organisms-bavarian-nordic-inc-11r4401,,"Infection, Virus, Vaccinia",eng,"science and technology, health>diseases and conditions, science and technology>natural science, science and technology>natural science>biology, health>diseases and conditions>communicable disease>virus disease, health, health>diseases and conditions>communicable disease>virus disease>retrovirus, science and technology>natural science>biology>genetics, health>diseases and conditions>communicable disease",10.1128/aem.00110-07
who-1396342e1ed866b28eba7c590455da46,Scientific review of research on smallpox virus,Publication,2013-08-02,https://apps.who.int/iris/handle/10665/85634,,,eng,,10.1021/jm050473m
who-cab07fdd4652f4f41886accfd0785672,"Scientific review of variola virus research, 1999-2010",Publication,2012-06-17,https://apps.who.int/iris/handle/10665/70610,,"Virus, Edward Jenner, DNA",spa,"health, health>diseases and conditions, health>diseases and conditions>communicable disease, health>diseases and conditions>communicable disease>virus disease, science and technology>natural science>biology, science and technology, science and technology>natural science, science and technology>natural science>biology>genetics, health>diseases and conditions>communicable disease>virus disease>retrovirus, health>diseases and conditions>communicable disease>epidemic",10.1021/jm050473m
who-39d1147c550a77622ac2df1ebe9d2451,"Scientific analysis of variola virus research, 1999-2010",Publication,2012-06-17,https://apps.who.int/iris/handle/10665/70609,,"Smallpox, Vaccination, Virus",fre,"health, health>diseases and conditions, health>diseases and conditions>communicable disease, health>diseases and conditions>communicable disease>virus disease, health>diseases and conditions>communicable disease>virus disease>retrovirus, science and technology>natural science>biology, science and technology, science and technology>natural science, science and technology>natural science>biology>genetics, health>diseases and conditions>communicable disease>epidemic",10.1021/jm050473m
who-b4072420d0e86f154392a97784590f51,"Scientific review of variola virus research, 1999-2010",Publication,2012-06-17,https://apps.who.int/iris/handle/10665/70508,,,eng,,10.1021/jm050473m
who-269e5872975525599bc2ffaddd1d011e,"Global Guiding Framework: Responsible Use of Life Sciences: Mitigating Biological Risks, Governing Dual-Use Research",Publication,2023-06-14,https://apps.who.int/iris/handle/10665/369236,,"Governance, Risk management, Risk",chi,"economy, business and finance, economy, business and finance>economic sector, science and technology>natural science, science and technology>natural science>biology, health>diseases and conditions, science and technology, health, economy, business and finance>economic sector>computing and information technology",10.1353/hcr.2007.0046
who-083c2a2238ce6b3cd059c032a7e92b40,Global policy framework for the responsible use of life sciences: mitigating biological risks and governing dual research,Publication,2023-06-13,https://apps.who.int/iris/handle/10665/369131,,"Governance, Safety, Natural environment",fre,"science and technology>natural science, health>diseases and conditions>communicable disease, science and technology>natural science>biology, health>diseases and conditions, science and technology, science and technology>natural science>biology>genetics, health, health>diseases and conditions>communicable disease>virus disease",10.1353/hcr.2007.0046
who-7f17601c4d68f6e97900f13184888703,Global Guidelines for the Responsible Use of Life Sciences Research: Biological Risk Reduction and Management of Dual Use Research,Publication,2023-06-13,https://apps.who.int/iris/handle/10665/369132,,"Health, Disease, Creative Commons license",rus,"science and technology>natural science, science and technology>natural science>biology, science and technology, health>diseases and conditions, health, science and technology>natural science>biology>genetics",10.1353/hcr.2007.0046
who-2328628190847b6aedf513fff1ba338d,Global Guidance Framework for Responsible Use of Life Sciences: Biohazard Reduction and Governance of Dual-Use Research,Publication,2023-06-09,https://apps.who.int/iris/handle/10665/368979,,"Infodemic, Governance, United Nations Security Council Resolution 1540",spa,"lifestyle and leisure, lifestyle and leisure>lifestyle, science and technology>natural science, science and technology>natural science>biology, science and technology, health>diseases and conditions, health, science and technology>natural science>biology>genetics, lifestyle and leisure>lifestyle>food and drink",10.1353/hcr.2007.0046
who-aa3ec977c0703d631c5009c21f3c2496,Global guidance framework for the responsible use of life sciences: mitigating biological risks and governing dual-use research,Publication,2023-01-01,https://apps.who.int/iris/handle/10665/374885,2. Regional Office for Africa,"Biology, Alzheimer's disease, Synthetic biology",por,"science and technology>natural science>biology, science and technology>natural science, science and technology, science and technology>natural science>biology>genetics, health>diseases and conditions, health, science and technology>social sciences",10.1353/hcr.2007.0046
interacademies-87ccbd94e76c0729d54d394ee120e1d4,Global guidance framework for the responsible use of the life sciences,Publication,2022-09-12,https://www.interacademies.org/publication/global-guidance-framework-responsible-use-life-sciences,,"Biosecurity, Biosafety, Risk",eng,"science and technology>natural science, science and technology>research, science and technology>natural science>biology, science and technology>natural science>biology>genetics, science and technology, health>diseases and conditions, health, science and technology>research>medical research",10.1353/hcr.2007.0046
who-f6488bdadd89245cefef23285bb10d1b,Global guidance framework for the responsible use of the life sciences: mitigating biorisks and governing dual-use research,Publication,2022-09-07,https://apps.who.int/iris/handle/10665/362313,,"Branches of science, Biodiversity, Gain-of-function research",eng,"science and technology>natural science, science and technology>natural science>biology, health>diseases and conditions, science and technology, health, science and technology>natural science>biology>genetics",10.1353/hcr.2007.0046
lseblogs-6650577eb9b0f37bc31d48f131bd9c28,Is openness in AI research always the answer?,Blog post,2019-07-30,https://blogs.lse.ac.uk/impactofsocialsciences/2019/07/30/is-openness-in-ai-research-always-the-answer/,,"Artificial intelligence, Research, Ethics of artificial intelligence",eng,"science and technology>social sciences, society>values>ethics, science and technology, society>values, society, science and technology>social sciences>philosophy",10.1353/hcr.2007.0046
who-cc0eac1b72ccd12e7cfae4a5c13bb743,Governance of dual-use research: an ethical dilemma,Publication,2018-03-26,https://apps.who.int/iris/handle/10665/270508,,"Biology, Human activities, Influenza",eng,"science and technology>natural science, health>diseases and conditions>communicable disease, health>diseases and conditions, health>diseases and conditions>communicable disease>virus disease, science and technology, science and technology>natural science>biology, health, science and technology>natural science>biology>genetics",10.1353/hcr.2007.0046
10.2796/28465,Responsible life sciences research for global health security: a guidance document,Publication,2012-06-17,https://apps.who.int/iris/handle/10665/70507,,"Biosafety, Biosecurity, Research",eng,"health>diseases and conditions, health>diseases and conditions>communicable disease, science and technology>natural science, health, science and technology>natural science>biology, health>diseases and conditions>communicable disease>virus disease, health>diseases and conditions>communicable disease>virus disease>retrovirus, health>diseases and conditions>communicable disease>epidemic, education, science and technology, society",10.1353/hcr.2007.0046
wilsoncenter-19fbbd381c6668f9890563efe58db0e4,Trends in American & European Press Coverage of Synthetic Biology,Publication,2010-03-12,https://www.wilsoncenter.org/publication/trends-american-european-press-coverage-synthetic-biology,,"Culture, Human activities, United States",eng,"arts, culture and entertainment, science and technology>natural science, science and technology>natural science>biology, science and technology, arts, culture and entertainment>mass media, science and technology>natural science>biology>genetics, arts, culture and entertainment>mass media>newspaper",10.1353/hcr.2007.0046
wilsoncenter-52264778fddce5d0793178464262ee09,Ethical Issues in Synthetic Biology,Publication,2009-01-24,https://www.wilsoncenter.org/publication/ethical-issues-synthetic-biology,,"Life sciences, Human activities, BioBrick",eng,"science and technology>natural science, science and technology>natural science>biology, science and technology, science and technology>natural science>biology>genetics, health, society",10.1353/hcr.2007.0046
unitednations-951c00bf0d11ebab7a440c1734d7a318,Oversight of science /,Publication,2008-07-14,https://digitallibrary.un.org/record/636800?ln=en,"BIOLOGICAL WEAPONS, BIOSAFETY, BIOTECHNOLOGY","Science, Open access, Nature",rus,"health>health treatment, science and technology>natural science, health, science and technology, science and technology>natural science>biology, health>health treatment>medicine, science and technology>natural science>biology>genetics",10.1353/hcr.2007.0046
who-1396342e1ed866b28eba7c590455da46,Scientific review of research on smallpox virus,Publication,2013-08-02,https://apps.who.int/iris/handle/10665/85634,,,eng,,10.1373/clinchem.2006.068635
who-cab07fdd4652f4f41886accfd0785672,"Scientific review of variola virus research, 1999-2010",Publication,2012-06-17,https://apps.who.int/iris/handle/10665/70610,,"Edward Jenner, Gene, DNA",spa,"health, health>diseases and conditions, health>diseases and conditions>communicable disease, health>diseases and conditions>communicable disease>virus disease, science and technology>natural science>biology, science and technology, science and technology>natural science, science and technology>natural science>biology>genetics, health>diseases and conditions>communicable disease>virus disease>retrovirus, health>diseases and conditions>communicable disease>epidemic",10.1373/clinchem.2006.068635
who-39d1147c550a77622ac2df1ebe9d2451,"Scientific analysis of variola virus research, 1999-2010",Publication,2012-06-17,https://apps.who.int/iris/handle/10665/70609,,"Smallpox, Vaccination, Virus",fre,"health, health>diseases and conditions, health>diseases and conditions>communicable disease, health>diseases and conditions>communicable disease>virus disease, health>diseases and conditions>communicable disease>virus disease>retrovirus, science and technology>natural science>biology, science and technology, science and technology>natural science, science and technology>natural science>biology>genetics, health>diseases and conditions>communicable disease>epidemic",10.1373/clinchem.2006.068635
who-b4072420d0e86f154392a97784590f51,"Scientific review of variola virus research, 1999-2010",Publication,2012-06-17,https://apps.who.int/iris/handle/10665/70508,,,eng,,10.1373/clinchem.2006.068635
kcdc-1f72f65a9a749ea409f73812dbf83e44,Center for Disease Control,Clinical guidance,2010-06-07,https://www.cdc.go.kr/board/board.es?mid=a20602010000&bid=0034&list_no=12467&act=view,,,kor,,10.1373/clinchem.2006.068635
kcdc-3e1be83fa217e14746d5806022c1e31f,Centers for Disease Control and Prevention,Clinical guidance,2010-06-07,https://www.kdca.go.kr/board/board.es?mid=a20602010000&bid=0034&list_no=12467&act=view,,"Vaccine, Vaccination, Microbiology",kor,"health>diseases and conditions>communicable disease, health>health treatment, science and technology, science and technology>natural science, health, health>diseases and conditions, science and technology>natural science>biology, health>health treatment>medicine, health>diseases and conditions>communicable disease>virus disease",10.1373/clinchem.2006.068635
deptofhealthau-5dba0201f4f481a6ca17c80deed6cd77,Questions about vaccination,Publication,2018-09-13,https://www.health.gov.au/resources/publications/questions-about-vaccination,,"MMR vaccine, Vaccine, Chickenpox",eng,"health>diseases and conditions, health>diseases and conditions>communicable disease, health, health>diseases and conditions>illness, health>diseases and conditions>communicable disease>virus disease",10.1086/588670
oieint-2501e3fbb066049ec0c1117176dd7d71,"Rabies Control - Towards sustainable prevention at the source - Global Conference on Rabies Control, Incheon-Seoul, Republic of Korea, 7-9 september 2011 - Compendium",Publication,2012-01-01,https://doc.oie.int/dyn/portal/index.xhtml?page=alo&aloId=34349&req=89,,"Viral quasispecies, Rabies, Post-exposure prophylaxis",eng,"health, health>diseases and conditions>communicable disease, science and technology>natural science, science and technology>natural science>biology, health>diseases and conditions, health>diseases and conditions>communicable disease>virus disease, science and technology>natural science>biology>genetics, science and technology",10.1016/j.jri.2006.04.006
stateofwesternaustralia-a98a96fdb2f45ff24ec7231c79b78123,Invasive Animals Cooperative Research Centre,Publication,2010-02-18,https://library.dbca.wa.gov.au/static/FullTextFiles/070250.pdf,,"Immunocontraception, Feral cat, Trapping",eng,"science and technology>natural science, science and technology>natural science>biology, environment, environment>nature, science and technology, science and technology>natural science>biology>genetics",10.1016/j.jri.2006.04.006
defrauk-69886e2f63199c5b07e948064d4f910d,Desk study to review environmental risks from marketing GM veterinary and human medicines,Publication,2009-03-10,http://cdm21006.contentdm.oclc.org/cdm/ref/collection/p21006coll3/id/2274,Science_Search_Collection,"Angiogenesis, Vectors in gene therapy, Genetically modified organism",eng,"health, health>diseases and conditions>communicable disease, science and technology>natural science>biology, science and technology, science and technology>natural science, science and technology>natural science>biology>genetics, health>diseases and conditions>communicable disease>virus disease, health>diseases and conditions, health>diseases and conditions>illness",10.1016/j.jri.2006.04.006
pacforum-0db8983eb7cd1743657328b3685a0678,Explore Pacific Forum's Insightful Indo-Pacific Analysis,Publication,2021-12-01,https://pacforum.org/publications/issues-insights-vol-21-sr4-the-united-states-and-singapore-indo-pacific-partners/,,"Zoonosis, United States, China–United States relations",eng,"politics, conflicts, war and peace, conflicts, war and peace>armed conflict, politics>government, politics>government>defence, science and technology, politics>government>defence>armed forces",10.3389/fpubh.2014.00115
govdeptsaustria-59443ee6b0e02b83a252c609b8e88c1f,Tomorrow ’ s Technology,Publication,2018-03-22,https://www.bmlv.gv.at/pdf_pool/publikationen/buch_dengg_tomorrows_technology_web.pdf,,"Bioterrorism, Technological singularity, Genome editing",eng,"economy, business and finance, economy, business and finance>economic sector, health, health>diseases and conditions, health>diseases and conditions>communicable disease, science and technology>natural science, science and technology>natural science>biology, science and technology>natural science>biology>genetics, science and technology, economy, business and finance>economic sector>computing and information technology, health>diseases and conditions>communicable disease>virus disease, conflicts, war and peace",10.3389/fpubh.2014.00115
governmentofcanada-6d238c4eb2758d7d17230c851726ce23,The next generation of emerging global challenges : a Horizons 2030 perspective on research opportunities / prepared for the Social Sciences and Humanities Research Council.,Publication,2018-01-01,http://publications.gc.ca/site/eng/9.865811/publication.html,,"Human activities, Family, Risk",eng,"science and technology>natural science, arts, culture and entertainment, science and technology>natural science>biology, health, environment, science and technology, society, arts, culture and entertainment>culture, science and technology>social sciences, society>values",10.3389/fpubh.2014.00115
govdeptsspain-365c8e861abc36c3340d6a130ecc965d,Bie newsletter,Publication,2017-12-21,https://publicaciones.defensa.gob.es/media/downloadable/files/links/b/o/boletin_del_ieee_7.pdf,,"Revolutionary Armed Forces of Colombia, Religion, Colombian peace process",spa,"religion and belief, conflicts, war and peace, conflicts, war and peace>armed conflict, science and technology, society, conflicts, war and peace>armed conflict>war, politics, politics>government",10.3389/fpubh.2014.00115
govdeptsspain-96361c86ce99ae5230cbb5fbf3b0cdec,[THIS TITLE IS BROKEN AND HAS BEEN REMOVED],Publication,2017-12-21,https://bibliotecavirtual.defensa.gob.es/BVMDefensa/es/catalogo_imagenes/grupo.do?path=180386,,"Revolutionary Armed Forces of Colombia, Religion, Leadership",spa,"conflicts, war and peace, politics, religion and belief>religious belief, religion and belief, religion and belief>religious belief>Christianity, politics>government, science and technology, conflicts, war and peace>armed conflict>war, conflicts, war and peace>armed conflict",10.3389/fpubh.2014.00115
